{
  "review_area": "result_review",
  "title": "Result review scorecard (outputs, visualizations, report)",
  "points": [
    {
      "id": "res.contract",
      "title": "Output contract compliance",
      "weight": 0.2,
      "score": 3,
      "notes": "Immutable source and read-only workspace evidence; no evaluator rerun."
    },
    {
      "id": "res.validator",
      "title": "Automated validator results",
      "weight": 0.1,
      "score": 2,
      "notes": "Immutable source and read-only workspace evidence; no evaluator rerun."
    },
    {
      "id": "res.completion",
      "title": "Case completion and convergence",
      "weight": 0.2,
      "score": 2,
      "notes": "Immutable source and read-only workspace evidence; no evaluator rerun."
    },
    {
      "id": "res.plausibility",
      "title": "Result plausibility and MPI consistency",
      "weight": 0.15,
      "score": 2,
      "notes": "Immutable source and read-only workspace evidence; no evaluator rerun."
    },
    {
      "id": "res.visualization",
      "title": "Visualizations",
      "weight": 0.15,
      "score": 3,
      "notes": "Immutable source and read-only workspace evidence; no evaluator rerun."
    },
    {
      "id": "res.report",
      "title": "Report quality and honesty",
      "weight": 0.15,
      "score": 3,
      "notes": "Immutable source and read-only workspace evidence; no evaluator rerun."
    },
    {
      "id": "res.traceability",
      "title": "Traceability of figures and claims",
      "weight": 0.05,
      "score": 2,
      "notes": "Immutable source and read-only workspace evidence; no evaluator rerun."
    }
  ],
  "disqualification_flags": [
    {
      "flag": "Figure files misnamed (e.g., Mach image that actually plots pressure)",
      "triggered": null,
      "notes": ""
    },
    {
      "flag": "Report figures do not correspond to submitted field/CSV outputs",
      "triggered": null,
      "notes": ""
    },
    {
      "flag": "Placeholder, synthetic, or intentionally partial result files in scored case dirs",
      "triggered": null,
      "notes": ""
    },
    {
      "flag": "metadata.json marks incomplete or failed runs as successful",
      "triggered": null,
      "notes": ""
    },
    {
      "flag": "Debug outputs presented as final case results",
      "triggered": null,
      "notes": ""
    }
  ],
  "overall_score": 2.5
}
