{
  "review_area": "result_review",
  "title": "Result review scorecard (outputs, visualizations, report)",
  "points": [
    {
      "id": "res.contract",
      "title": "Output contract compliance",
      "weight": 0.2,
      "score": 5,
      "notes": "All eight raw output directories and report passed explicit validator in detached attempt worktree."
    },
    {
      "id": "res.validator",
      "title": "Automated validator results",
      "weight": 0.1,
      "score": 5,
      "notes": "validate_outputs.py returned success for eight named final directories and report."
    },
    {
      "id": "res.completion",
      "title": "Case completion and convergence",
      "weight": 0.2,
      "score": 4,
      "notes": "All packages are readable and complete; Re200 target-convergence claim is contradicted by source and last ratio 0.3696."
    },
    {
      "id": "res.plausibility",
      "title": "Result plausibility and MPI consistency",
      "weight": 0.15,
      "score": 3,
      "notes": "Fields/figures and force histories are delivered, but many steady residual reductions are below two orders and Re200 spectrum is admitted broad-band."
    },
    {
      "id": "res.visualization",
      "title": "Visualizations",
      "weight": 0.15,
      "score": 4,
      "notes": "Curated referenced figures cover histories, Cp and fields; some zoom figures were excluded as unreferenced and report prose has a Re20/Re200 vorticity typo."
    },
    {
      "id": "res.report",
      "title": "Report quality and honesty",
      "weight": 0.15,
      "score": 4,
      "notes": "Report has methods, tables, figures and limitations, but overstates strict Re200 inner convergence/statistical confidence."
    },
    {
      "id": "res.traceability",
      "title": "Traceability of figures and claims",
      "weight": 0.05,
      "score": 4,
      "notes": "Raw report includes manifests/sanity checks and validator passes; curated TeX retains referenced figures."
    }
  ],
  "disqualification_flags": [
    {
      "flag": "Figure files misnamed (e.g., Mach image that actually plots pressure)",
      "triggered": null,
      "notes": ""
    },
    {
      "flag": "Report figures do not correspond to submitted field/CSV outputs",
      "triggered": null,
      "notes": ""
    },
    {
      "flag": "Placeholder, synthetic, or intentionally partial result files in scored case dirs",
      "triggered": null,
      "notes": ""
    },
    {
      "flag": "metadata.json marks incomplete or failed runs as successful",
      "triggered": null,
      "notes": ""
    },
    {
      "flag": "Debug outputs presented as final case results",
      "triggered": null,
      "notes": ""
    }
  ],
  "overall_score": 4.15
}
