{
  "review_area": "cfd_review",
  "title": "CFD methods and algorithms review scorecard",
  "points": [
    {
      "id": "cfd.equations",
      "title": "Governing equations and nondimensionalization",
      "weight": 0.06,
      "score": 4,
      "notes": "Compressible conservative state and perfect-gas formulation present."
    },
    {
      "id": "cfd.mesh",
      "title": "Mesh import and unstructured geometry",
      "weight": 0.1,
      "score": 4,
      "notes": "CGNS unstructured mesh and graph assembly source present."
    },
    {
      "id": "cfd.residual",
      "title": "Conservative finite-volume residual",
      "weight": 0.12,
      "score": 4,
      "notes": "Face residual accumulation and global norms are implemented."
    },
    {
      "id": "cfd.flux",
      "title": "Approximate Riemann flux and entropy fix",
      "weight": 0.08,
      "score": 2,
      "notes": "Rusanov exists, but Roe function returns Rusanov; contradicts report."
    },
    {
      "id": "cfd.bc",
      "title": "Boundary conditions",
      "weight": 0.08,
      "score": 4,
      "notes": "Farfield, slip, and no-slip branches present."
    },
    {
      "id": "cfd.reconstruction",
      "title": "Second-order reconstruction",
      "weight": 0.09,
      "score": 4,
      "notes": "Least-squares reconstructed face states present."
    },
    {
      "id": "cfd.limiter",
      "title": "Limiter and positivity control",
      "weight": 0.08,
      "score": 4,
      "notes": "Barth--Jespersen limiter and positivity paths present."
    },
    {
      "id": "cfd.viscous",
      "title": "Viscous discretization",
      "weight": 0.1,
      "score": 2,
      "notes": "Viscous path exists but results show nonphysical force behavior."
    },
    {
      "id": "cfd.implicit",
      "title": "Implicit steady march",
      "weight": 0.1,
      "score": 3,
      "notes": "LU-SGS/Jacobi pseudo-time source present but stability is limited."
    },
    {
      "id": "cfd.transient",
      "title": "Transient BDF2 two-loop method (Re 200)",
      "weight": 0.1,
      "score": 2,
      "notes": "BDF2-style two-loop code exists; submitted Re200 controls/results do not meet production evidence."
    },
    {
      "id": "cfd.mpi_partition",
      "title": "MPI partitioning and scalability",
      "weight": 0.09,
      "score": 4,
      "notes": "METIS and point-to-point halo exchange/source reductions present."
    }
  ],
  "disqualification_flags": [
    {
      "flag": "Solver uses explicit time stepping only",
      "triggered": null,
      "notes": ""
    },
    {
      "flag": "Report claims second-order reconstruction or limiter that is disabled in production",
      "triggered": null,
      "notes": ""
    },
    {
      "flag": "metadata.json claims METIS/ParMETIS but code uses geometric split or full-state replication",
      "triggered": null,
      "notes": ""
    },
    {
      "flag": "Re 200 run reaches final time but misses inner target on most steps (failed transient solve presented as periodic)",
      "triggered": null,
      "notes": ""
    },
    {
      "flag": "Normal viscous traction mislabeled as skin friction",
      "triggered": null,
      "notes": ""
    },
    {
      "flag": "Surface no-slip rows are actually adjacent cell-center velocities without documentation",
      "triggered": null,
      "notes": ""
    }
  ],
  "overall_score": 3.34
}
