{
  "review_area": "cfd_review",
  "title": "CFD methods and algorithms review scorecard",
  "points": [
    {
      "id": "cfd.equations",
      "title": "Governing equations and nondimensionalization",
      "weight": 0.06,
      "score": 4,
      "notes": "Report/source document compressible governing variables and nondimensional controls."
    },
    {
      "id": "cfd.mesh",
      "title": "Mesh import and unstructured geometry",
      "weight": 0.1,
      "score": 4,
      "notes": "CGNS unstructured mesh, adjacency and boundary families are implemented/documented."
    },
    {
      "id": "cfd.residual",
      "title": "Conservative finite-volume residual",
      "weight": 0.12,
      "score": 4,
      "notes": "Cell-centered conservative FV residual assembly is documented and present in source."
    },
    {
      "id": "cfd.flux",
      "title": "Approximate Riemann flux and entropy fix",
      "weight": 0.08,
      "score": 4,
      "notes": "Rusanov numerical flux is explicit; diffusive but legitimate."
    },
    {
      "id": "cfd.bc",
      "title": "Boundary conditions",
      "weight": 0.08,
      "score": 4,
      "notes": "Farfield, slip and no-slip adiabatic treatments are documented with reported gates."
    },
    {
      "id": "cfd.reconstruction",
      "title": "Second-order reconstruction",
      "weight": 0.09,
      "score": 3,
      "notes": "Least-squares linear reconstruction exists, but steady high-order sweep is only every 25th outer step."
    },
    {
      "id": "cfd.limiter",
      "title": "Limiter and positivity control",
      "weight": 0.08,
      "score": 4,
      "notes": "Limiter/positivity controls are documented as production-active."
    },
    {
      "id": "cfd.viscous",
      "title": "Viscous discretization",
      "weight": 0.1,
      "score": 4,
      "notes": "Newtonian/Fourier treatment and tangential skin-friction reporting are described."
    },
    {
      "id": "cfd.implicit",
      "title": "Implicit steady march",
      "weight": 0.1,
      "score": 4,
      "notes": "Local block-Jacobi implicit relaxation and CFL/local controls are described; not a coupled LU-SGS method."
    },
    {
      "id": "cfd.transient",
      "title": "Transient BDF2 two-loop method (Re 200)",
      "weight": 0.1,
      "score": 4,
      "notes": "Reported BDF2 dual-time loop reaches t=300 with frozen histories, target-miss and inner-iteration statistics in immutable result evidence."
    },
    {
      "id": "cfd.mpi_partition",
      "title": "MPI partitioning and scalability",
      "weight": 0.09,
      "score": 4,
      "notes": "METIS, halo exchange, reductions and np=1/8 evidence are reported."
    }
  ],
  "disqualification_flags": [
    {
      "flag": "Solver uses explicit time stepping only",
      "triggered": null,
      "notes": ""
    },
    {
      "flag": "Report claims second-order reconstruction or limiter that is disabled in production",
      "triggered": null,
      "notes": ""
    },
    {
      "flag": "metadata.json claims METIS/ParMETIS but code uses geometric split or full-state replication",
      "triggered": null,
      "notes": ""
    },
    {
      "flag": "Re 200 run reaches final time but misses inner target on most steps (failed transient solve presented as periodic)",
      "triggered": null,
      "notes": ""
    },
    {
      "flag": "Normal viscous traction mislabeled as skin friction",
      "triggered": null,
      "notes": ""
    },
    {
      "flag": "Surface no-slip rows are actually adjacent cell-center velocities without documentation",
      "triggered": null,
      "notes": ""
    }
  ],
  "overall_score": 3.91
}
