{
  "review_area": "cfd_review",
  "title": "CFD methods and algorithms review scorecard",
  "points": [
    {
      "id": "cfd.equations",
      "title": "Governing equations and nondimensionalization",
      "weight": 0.06,
      "score": 5,
      "notes": "Conservative perfect-gas equations and coefficient normalization match source/report."
    },
    {
      "id": "cfd.mesh",
      "title": "Mesh import and unstructured geometry",
      "weight": 0.1,
      "score": 5,
      "notes": "CGNS unstructured zones, mixed cells, boundary families, geometry and adjacency are implemented."
    },
    {
      "id": "cfd.residual",
      "title": "Conservative finite-volume residual",
      "weight": 0.12,
      "score": 5,
      "notes": "Face-oriented cell-centred FV residual with globally reduced norms found."
    },
    {
      "id": "cfd.flux",
      "title": "Approximate Riemann flux and entropy fix",
      "weight": 0.08,
      "score": 4,
      "notes": "Rusanov flux is implemented and honestly disclosed as diffusive."
    },
    {
      "id": "cfd.bc",
      "title": "Boundary conditions",
      "weight": 0.08,
      "score": 5,
      "notes": "Farfield, slip and no-slip adiabatic paths plus surface semantics are documented."
    },
    {
      "id": "cfd.reconstruction",
      "title": "Second-order reconstruction",
      "weight": 0.09,
      "score": 5,
      "notes": "WLS piecewise-linear reconstruction with production activation after continuation is source/metadata supported."
    },
    {
      "id": "cfd.limiter",
      "title": "Limiter and positivity control",
      "weight": 0.08,
      "score": 5,
      "notes": "Active Barth-Jespersen limiting and density/pressure safeguards are present."
    },
    {
      "id": "cfd.viscous",
      "title": "Viscous discretization",
      "weight": 0.1,
      "score": 5,
      "notes": "Corrected primitive gradients, Newtonian/Fourier flux and tangential skin-friction split are implemented."
    },
    {
      "id": "cfd.implicit",
      "title": "Implicit steady march",
      "weight": 0.1,
      "score": 5,
      "notes": "Implicit local pseudo-time / matrix-free Krylov controls and residual evidence are present."
    },
    {
      "id": "cfd.transient",
      "title": "Transient BDF2 two-loop method (Re 200)",
      "weight": 0.1,
      "score": 5,
      "notes": "Read-only Re200 evidence reaches dt=0.01, t=300, BDF2 frozen-history control and 99.71% inner attainment; not rerun."
    },
    {
      "id": "cfd.mpi_partition",
      "title": "MPI partitioning and scalability",
      "weight": 0.09,
      "score": 5,
      "notes": "Eight-rank NACA/cylinder final runs plus np1/2/4 comparisons show near-identical terminal forces."
    }
  ],
  "disqualification_flags": [
    {
      "flag": "Solver uses explicit time stepping only",
      "triggered": null,
      "notes": ""
    },
    {
      "flag": "Report claims second-order reconstruction or limiter that is disabled in production",
      "triggered": null,
      "notes": ""
    },
    {
      "flag": "metadata.json claims METIS/ParMETIS but code uses geometric split or full-state replication",
      "triggered": null,
      "notes": ""
    },
    {
      "flag": "Re 200 run reaches final time but misses inner target on most steps (failed transient solve presented as periodic)",
      "triggered": null,
      "notes": ""
    },
    {
      "flag": "Normal viscous traction mislabeled as skin friction",
      "triggered": null,
      "notes": ""
    },
    {
      "flag": "Surface no-slip rows are actually adjacent cell-center velocities without documentation",
      "triggered": null,
      "notes": ""
    }
  ],
  "overall_score": 4.92
}
