{
  "review_area": "result_review",
  "title": "Result review scorecard (outputs, visualizations, report)",
  "points": [
    {
      "id": "res.contract",
      "title": "Output contract compliance",
      "weight": 0.2,
      "score": 5,
      "notes": "Explicit validator accepted all eight specified original workspace packages and the report."
    },
    {
      "id": "res.validator",
      "title": "Automated validator results",
      "weight": 0.1,
      "score": 5,
      "notes": "Recorded full explicit examiner invocation returned rc 0; Re200 was not rerun."
    },
    {
      "id": "res.completion",
      "title": "Case completion and convergence",
      "weight": 0.2,
      "score": 5,
      "notes": "Seven steady packages are completed/converged; Re200 is completed/statistically_periodic with readable finite histories."
    },
    {
      "id": "res.plausibility",
      "title": "Result plausibility and MPI consistency",
      "weight": 0.15,
      "score": 5,
      "notes": "Finite histories, rank studies and report evidence support plausible results; reported low-Mach dissipation is candidly limited."
    },
    {
      "id": "res.visualization",
      "title": "Visualizations",
      "weight": 0.15,
      "score": 5,
      "notes": "Committed report figures cover the cases and manifest has 66 entries with no missing figure files."
    },
    {
      "id": "res.report",
      "title": "Report quality and honesty",
      "weight": 0.15,
      "score": 5,
      "notes": "Detailed report documents methods, results, BDF2 behavior and stated low-Mach/limiter limitations."
    },
    {
      "id": "res.traceability",
      "title": "Traceability of figures and claims",
      "weight": 0.05,
      "score": 4,
      "notes": "Figure manifest is present and resolves figure files; raw result inputs remain read-only workspace evidence outside the curated commit."
    }
  ],
  "disqualification_flags": [
    {
      "flag": "Figure files misnamed (e.g., Mach image that actually plots pressure)",
      "triggered": null,
      "notes": ""
    },
    {
      "flag": "Report figures do not correspond to submitted field/CSV outputs",
      "triggered": null,
      "notes": ""
    },
    {
      "flag": "Placeholder, synthetic, or intentionally partial result files in scored case dirs",
      "triggered": null,
      "notes": ""
    },
    {
      "flag": "metadata.json marks incomplete or failed runs as successful",
      "triggered": null,
      "notes": ""
    },
    {
      "flag": "Debug outputs presented as final case results",
      "triggered": null,
      "notes": ""
    }
  ],
  "overall_score": 4.95
}
