{
  "review_area": "result_review",
  "title": "Result review scorecard (outputs, visualizations, report)",
  "points": [
    {
      "id": "res.contract",
      "title": "Output contract compliance",
      "weight": 0.2,
      "score": 2,
      "notes": "Directories exist but validator sees failed status."
    },
    {
      "id": "res.validator",
      "title": "Automated validator results",
      "weight": 0.1,
      "score": 1,
      "notes": "Explicit validator fails immediately."
    },
    {
      "id": "res.completion",
      "title": "Case completion and convergence",
      "weight": 0.2,
      "score": 1,
      "notes": "Report admits broad instability/divergence."
    },
    {
      "id": "res.plausibility",
      "title": "Result plausibility and MPI consistency",
      "weight": 0.15,
      "score": 1,
      "notes": "No credible canonical converged evidence."
    },
    {
      "id": "res.visualization",
      "title": "Visualizations",
      "weight": 0.15,
      "score": 2,
      "notes": "Committed short-test figures only."
    },
    {
      "id": "res.report",
      "title": "Report quality and honesty",
      "weight": 0.15,
      "score": 3,
      "notes": "4-page report builds and is candid."
    },
    {
      "id": "res.traceability",
      "title": "Traceability of figures and claims",
      "weight": 0.05,
      "score": 2,
      "notes": "Limited figure/report traceability; manifest excluded."
    }
  ],
  "disqualification_flags": [
    {
      "flag": "Figure files misnamed (e.g., Mach image that actually plots pressure)",
      "triggered": null,
      "notes": ""
    },
    {
      "flag": "Report figures do not correspond to submitted field/CSV outputs",
      "triggered": null,
      "notes": ""
    },
    {
      "flag": "Placeholder, synthetic, or intentionally partial result files in scored case dirs",
      "triggered": null,
      "notes": ""
    },
    {
      "flag": "metadata.json marks incomplete or failed runs as successful",
      "triggered": null,
      "notes": ""
    },
    {
      "flag": "Debug outputs presented as final case results",
      "triggered": null,
      "notes": ""
    }
  ],
  "overall_score": 1.7
}
