{
  "review_area": "cfd_review",
  "title": "CFD methods and algorithms review scorecard",
  "points": [
    {
      "id": "cfd.equations",
      "title": "Governing equations and nondimensionalization",
      "weight": 0.06,
      "score": 4,
      "notes": "Conservative perfect-gas state, fluxes, and Reynolds-derived viscosity are implemented/described."
    },
    {
      "id": "cfd.mesh",
      "title": "Mesh import and unstructured geometry",
      "weight": 0.1,
      "score": 4,
      "notes": "CGNS reader, mixed-element geometry, faces, centers, volumes and graph structures are present in source."
    },
    {
      "id": "cfd.residual",
      "title": "Conservative finite-volume residual",
      "weight": 0.12,
      "score": 3,
      "notes": "Face residual accumulation and global reductions are implemented, but no submitted numerical result verifies conservation or terminal behavior."
    },
    {
      "id": "cfd.flux",
      "title": "Approximate Riemann flux and entropy fix",
      "weight": 0.08,
      "score": 3,
      "notes": "Roe/Harten-Hyman and Rusanov implementations exist. output.hpp always identifies Roe even when --rusanov selects Rusanov, so metadata fidelity is defective."
    },
    {
      "id": "cfd.bc",
      "title": "Boundary conditions",
      "weight": 0.08,
      "score": 3,
      "notes": "Farfield, slip, and direct no-slip wall branches are present; no result/surface output validates the physical boundary treatment."
    },
    {
      "id": "cfd.reconstruction",
      "title": "Second-order reconstruction",
      "weight": 0.09,
      "score": 4,
      "notes": "Weighted least-squares primitive gradients and reconstructed face states are present; first-order ghost/initial fallbacks are disclosed in source."
    },
    {
      "id": "cfd.limiter",
      "title": "Limiter and positivity control",
      "weight": 0.08,
      "score": 4,
      "notes": "Barth-Jespersen-style limiter plus density/pressure fallback/revert logic is present."
    },
    {
      "id": "cfd.viscous",
      "title": "Viscous discretization",
      "weight": 0.1,
      "score": 3,
      "notes": "Newtonian/Fourier normal viscous-flux and wall-gradient code is present, without submitted laminar evidence."
    },
    {
      "id": "cfd.implicit",
      "title": "Implicit steady march",
      "weight": 0.1,
      "score": 3,
      "notes": "LU-SGS-like sweep and CFL spectral radii are present, but README production command overrides case controls and no credible steady output is submitted."
    },
    {
      "id": "cfd.transient",
      "title": "Transient BDF2 two-loop method (Re 200)",
      "weight": 0.1,
      "score": 3,
      "notes": "Physical-time outer loop, frozen histories and inner iterations exist. README/report state max-inner=1 override, violating requested minimum, and no Re200 artifact demonstrates its execution."
    },
    {
      "id": "cfd.mpi_partition",
      "title": "MPI partitioning and scalability",
      "weight": 0.09,
      "score": 4,
      "notes": "METIS_PartGraphKway, rank-local owned/ghost sets, neighbor communication and reductions are source-evidenced; scalability remains unmeasured."
    }
  ],
  "disqualification_flags": [
    {
      "flag": "Solver uses explicit time stepping only",
      "triggered": null,
      "notes": ""
    },
    {
      "flag": "Report claims second-order reconstruction or limiter that is disabled in production",
      "triggered": null,
      "notes": ""
    },
    {
      "flag": "metadata.json claims METIS/ParMETIS but code uses geometric split or full-state replication",
      "triggered": null,
      "notes": ""
    },
    {
      "flag": "Re 200 run reaches final time but misses inner target on most steps (failed transient solve presented as periodic)",
      "triggered": null,
      "notes": ""
    },
    {
      "flag": "Normal viscous traction mislabeled as skin friction",
      "triggered": null,
      "notes": ""
    },
    {
      "flag": "Surface no-slip rows are actually adjacent cell-center velocities without documentation",
      "triggered": null,
      "notes": ""
    }
  ],
  "overall_score": 3.42
}
