{
  "review_area": "result_review",
  "title": "Result review scorecard (outputs, visualizations, report)",
  "points": [
    {
      "id": "res.contract",
      "title": "Output contract compliance",
      "weight": 0.2,
      "score": 5,
      "notes": "All eight required package layouts pass validator."
    },
    {
      "id": "res.validator",
      "title": "Automated validator results",
      "weight": 0.1,
      "score": 5,
      "notes": "Explicit validate_outputs.py invocation passed eight final case directories and report."
    },
    {
      "id": "res.completion",
      "title": "Case completion and convergence",
      "weight": 0.2,
      "score": 5,
      "notes": "Seven steady final packages reach stated targets; Re200 is statistically periodic at t=300 with no reported inner-target misses."
    },
    {
      "id": "res.plausibility",
      "title": "Result plausibility and MPI consistency",
      "weight": 0.15,
      "score": 4,
      "notes": "Delivered force/field/report and rank-study evidence is plausible; not independently rerun."
    },
    {
      "id": "res.visualization",
      "title": "Visualizations",
      "weight": 0.15,
      "score": 5,
      "notes": "Visually reviewed 24-page workspace report includes histories and computed field views for all cases."
    },
    {
      "id": "res.report",
      "title": "Report quality and honesty",
      "weight": 0.15,
      "score": 5,
      "notes": "Report is technically detailed and discloses high-Mach control escalation and prior under-convergence."
    },
    {
      "id": "res.traceability",
      "title": "Traceability of figures and claims",
      "weight": 0.05,
      "score": 4,
      "notes": "Figure manifest/report map figures to result files, but curation excludes raw results/manifest from immutable tip."
    }
  ],
  "disqualification_flags": [
    {
      "flag": "Figure files misnamed (e.g., Mach image that actually plots pressure)",
      "triggered": null,
      "notes": ""
    },
    {
      "flag": "Report figures do not correspond to submitted field/CSV outputs",
      "triggered": null,
      "notes": ""
    },
    {
      "flag": "Placeholder, synthetic, or intentionally partial result files in scored case dirs",
      "triggered": null,
      "notes": ""
    },
    {
      "flag": "metadata.json marks incomplete or failed runs as successful",
      "triggered": null,
      "notes": ""
    },
    {
      "flag": "Debug outputs presented as final case results",
      "triggered": null,
      "notes": ""
    }
  ],
  "overall_score": 4.8
}
