{
  "review_area": "result_review",
  "title": "Result review scorecard (outputs, visualizations, report)",
  "points": [
    {
      "id": "res.contract",
      "title": "Output contract compliance",
      "weight": 0.2,
      "score": 5,
      "notes": "Read-only explicit validator accepted all eight canonical case packages and the report; each package has the required structural files."
    },
    {
      "id": "res.validator",
      "title": "Automated validator results",
      "weight": 0.1,
      "score": 5,
      "notes": "Explicit examiner validate_outputs.py invocation over all eight original workspace packages and report returned rc 0."
    },
    {
      "id": "res.completion",
      "title": "Case completion and convergence",
      "weight": 0.2,
      "score": 5,
      "notes": "Seven canonical steady packages are completed/converged and Re200 is completed/statistically_periodic in readable metadata/run-status evidence."
    },
    {
      "id": "res.plausibility",
      "title": "Result plausibility and MPI consistency",
      "weight": 0.15,
      "score": 4,
      "notes": "Delivered fields/histories and report support finite, positive, credible results; rank comparison remains qualified by the report's executable-hash caveat."
    },
    {
      "id": "res.visualization",
      "title": "Visualizations",
      "weight": 0.15,
      "score": 5,
      "notes": "Committed report source references extensive field/history/wake visualizations and the workspace manifest resolves their delivered sources."
    },
    {
      "id": "res.report",
      "title": "Report quality and honesty",
      "weight": 0.15,
      "score": 3,
      "notes": "Technically detailed report and candid limitations, but the curated committed TeX cannot compile because required PDFs were excluded from the submission."
    },
    {
      "id": "res.traceability",
      "title": "Traceability of figures and claims",
      "weight": 0.05,
      "score": 4,
      "notes": "Manifest/report link figures and claims to readable workspace data, but paths are workspace-absolute and raw source data is intentionally absent from the immutable result commit."
    }
  ],
  "disqualification_flags": [
    {
      "flag": "Figure files misnamed (e.g., Mach image that actually plots pressure)",
      "triggered": null,
      "notes": ""
    },
    {
      "flag": "Report figures do not correspond to submitted field/CSV outputs",
      "triggered": null,
      "notes": ""
    },
    {
      "flag": "Placeholder, synthetic, or intentionally partial result files in scored case dirs",
      "triggered": null,
      "notes": ""
    },
    {
      "flag": "metadata.json marks incomplete or failed runs as successful",
      "triggered": null,
      "notes": ""
    },
    {
      "flag": "Debug outputs presented as final case results",
      "triggered": null,
      "notes": ""
    }
  ],
  "overall_score": 4.5
}
