{
  "review_area": "code_review",
  "title": "Code review scorecard",
  "points": [
    {
      "id": "code.build",
      "title": "Build system and reproducibility",
      "weight": 0.15,
      "score": 3,
      "notes": "Modular C++ source, no independent rebuild."
    },
    {
      "id": "code.cli",
      "title": "CLI and error handling",
      "weight": 0.1,
      "score": 2,
      "notes": "Only partial output/CLI evidence."
    },
    {
      "id": "code.organization",
      "title": "Code organization and extensibility",
      "weight": 0.12,
      "score": 4,
      "notes": "Good module split."
    },
    {
      "id": "code.originality",
      "title": "Originality and license compliance",
      "weight": 0.15,
      "score": 4,
      "notes": "No external solver found; no external search."
    },
    {
      "id": "code.hardcoding",
      "title": "No hard-coded case logic",
      "weight": 0.08,
      "score": 3,
      "notes": "Input config driven."
    },
    {
      "id": "code.mpi",
      "title": "MPI correctness",
      "weight": 0.15,
      "score": 3,
      "notes": "METIS/MPI source present, no rank comparison."
    },
    {
      "id": "code.robustness",
      "title": "Robustness and memory sanity",
      "weight": 0.08,
      "score": 2,
      "notes": "Only first case has complete package."
    },
    {
      "id": "code.testing",
      "title": "Testing and validation evidence",
      "weight": 0.1,
      "score": 2,
      "notes": "Session shows development but incomplete final suite."
    },
    {
      "id": "code.hygiene",
      "title": "Code hygiene",
      "weight": 0.07,
      "score": 2,
      "notes": "Raw/debug outputs excluded from result tip."
    }
  ],
  "disqualification_flags": [
    {
      "flag": "Existing solver executable called internally",
      "triggered": null,
      "notes": ""
    },
    {
      "flag": "Force/residual files generated without solving",
      "triggered": null,
      "notes": ""
    },
    {
      "flag": "Code only reads the two benchmark mesh filenames through hard-coded branches",
      "triggered": null,
      "notes": ""
    },
    {
      "flag": "MPI rank count changes results by order-one amounts for steady cases",
      "triggered": null,
      "notes": ""
    },
    {
      "flag": "Explicit time stepping only (no implicit/steady capability claimed where required)",
      "triggered": null,
      "notes": ""
    },
    {
      "flag": "Report claims algorithms that cannot be found in source",
      "triggered": null,
      "notes": ""
    },
    {
      "flag": "metadata.json marks incomplete/failed runs as successful",
      "triggered": null,
      "notes": ""
    },
    {
      "flag": "Solver core, time integration, or MPI communication copied/adapted/wrapped from an existing open-source CFD codebase",
      "triggered": null,
      "notes": ""
    }
  ],
  "overall_score": 2.92
}
