{
  "review_area": "result_review",
  "title": "Result review scorecard (outputs, visualizations, report)",
  "points": [
    {
      "id": "res.contract",
      "title": "Output contract compliance",
      "weight": 0.2,
      "score": 0,
      "notes": "No solver/results files are tracked in the curated commit or source attempt; explicit validator therefore fails immediately for missing metadata.json."
    },
    {
      "id": "res.validator",
      "title": "Automated validator results",
      "weight": 0.1,
      "score": 0,
      "notes": "Evaluator explicit validator at source attempt be266cd fails: missing solver/results/naca0012_m015_inviscid/metadata.json."
    },
    {
      "id": "res.completion",
      "title": "Case completion and convergence",
      "weight": 0.2,
      "score": 1,
      "notes": "A compiled six-page report tabulates claims, but none of eight required raw packages is retained for verification."
    },
    {
      "id": "res.plausibility",
      "title": "Result plausibility and MPI consistency",
      "weight": 0.15,
      "score": 1,
      "notes": "Some report figures look interpretable, but absent fields/CSVs prevent numerical or MPI plausibility review."
    },
    {
      "id": "res.visualization",
      "title": "Visualizations",
      "weight": 0.15,
      "score": 2,
      "notes": "The committed report compiles and includes selected readable figures, but it lacks required history/surface/cylinder-pressure coverage and source data."
    },
    {
      "id": "res.report",
      "title": "Report quality and honesty",
      "weight": 0.15,
      "score": 3,
      "notes": "Report has equations, table, figures and candid convergence limitation, but overclaims complete validated outputs and contradicts source on production spatial order."
    },
    {
      "id": "res.traceability",
      "title": "Traceability of figures and claims",
      "weight": 0.05,
      "score": 0,
      "notes": "figure_manifest, run_manifest, sanity checks, result CSVs and fields are absent from the immutable submission and attempt commit."
    }
  ],
  "disqualification_flags": [
    {
      "flag": "Figure files misnamed (e.g., Mach image that actually plots pressure)",
      "triggered": null,
      "notes": ""
    },
    {
      "flag": "Report figures do not correspond to submitted field/CSV outputs",
      "triggered": null,
      "notes": ""
    },
    {
      "flag": "Placeholder, synthetic, or intentionally partial result files in scored case dirs",
      "triggered": null,
      "notes": ""
    },
    {
      "flag": "metadata.json marks incomplete or failed runs as successful",
      "triggered": null,
      "notes": ""
    },
    {
      "flag": "Debug outputs presented as final case results",
      "triggered": null,
      "notes": ""
    }
  ],
  "overall_score": 1.1
}
